{
  "$schema": "http://json-schema.org/draft-07/schema#",
  "title": "GetSession",
  "type": "object",
  "additionalProperties": false,
  "properties": {
    "messageId": {
      "$ref": "#/$defs/ID"
    },
    "type": {
      "type": "string",
      "const": "GetSession"
    },
    "version": {
      "type": "string",
      "const": "1.0.0"
    },
    "occurredAt": {
      "$ref": "#/$defs/Timestamp"
    },
    "tenantId": {
      "$ref": "#/$defs/ID"
    },
    "regionId": {
      "$ref": "#/$defs/ID"
    },
    "clusterId": {
      "$ref": "#/$defs/ID"
    },
    "correlationId": {
      "$ref": "#/$defs/ID"
    },
    "data": {
      "$ref": "#/$defs/GetSessionData"
    }
  },
  "required": [
    "messageId",
    "type",
    "version",
    "occurredAt",
    "tenantId",
    "regionId",
    "clusterId",
    "correlationId",
    "data"
  ],
  "$defs": {
    "GetSessionData": {
      "type": "object",
      "additionalProperties": false,
      "properties": {
        "sessionId": {
          "$ref": "#/$defs/ID"
        }
      },
      "required": [
        "sessionId"
      ]
    },
    "ID": {
      "type": "string",
      "pattern": "^[A-Za-z0-9][A-Za-z0-9_-]{0,127}$",
      "maxLength": 128
    },
    "Timestamp": {
      "type": "string",
      "format": "date-time"
    }
  }
}
